{
  "text": "Решение «выходить / не выходить» с управлением рисками (ИИ задаст уточнения).\n\nКонтекст:\nПланируется прибрежный переход 20–25 миль с неопытным экипажем. Прогноз: ветер усилится с 6 до 12–14 м/с к вечеру, возможны шквалы. По маршруту есть несколько укрытий. Судно в хорошем состоянии, но цель — минимизировать риск.\n\nЗадание:\nПримите решение (идти / идти с изменениями / не идти). Обоснуйте по модели:\n- Риски\n- Контроли (меры профилактики)\n- Триггеры (чёткие критерии разворота/укрытия)\n- План B\n\nЗатем ответьте на 2–3 уточняющих вопроса от ИИ.",
  "difficulty": 5,
  "correct_answer": "Сильный ответ выбирает консервативное решение, соразмерное квалификации экипажа и тренду прогноза (часто это «идти с изменениями» или «не идти» — зависит от судна/района). Явно перечисляет риски (усиление ветра, шквалы, усталость, морская болезнь, рост навигационной нагрузки, падение запаса безопасности), контроли (сократить маршрут, выйти раньше, план рифления/уменьшения парусности при необходимости, политика безопасной скорости, обязательные жилеты, распределение ролей, проверка связи, точки укрытий и разворота, учёт светового дня), триггеры (порог ветра/волны, видимость, состояние экипажа, лимит времени, отказы оборудования) и План B (ближайшие укрытия, точки отмены, план связи, маршрут возврата).\n\nЛучшие ответы измеримы: пороги и точки решения, а не общие слова. И демонстрируют трезвость: перепроверка прогноза, локальных эффектов и постоянная переоценка обстановки.",
  "explanation": "Это вопрос с высоким сигналом: показывает суждение, грамотность в рисках и операционную дисциплину.",
  "ai_context": "Задайте 2–3 сократических уточнения, чтобы добиться конкретики. Фокус: (1) пороги (ветер/волна/видимость/время), (2) контроли по экипажу (роли, усталость, жилеты), (3) точки укрытия/отмены и план связи. Оценивайте практичность и измеримые триггеры; снижайте за «ну мы будем осторожны» без конкретики.",
  "max_turns": 6,
  "min_words_per_turn": 35
}
