{
  "text": "Вы внедряете генеративного ИИ-ассистента в поддержку клиентов. Опишите ключевые риски и как вы будете их снижать. ИИ задаст уточняющие вопросы.",
  "difficulty": 5,
  "max_turns": 5,
  "min_words_per_turn": 20,
  "correct_answer": "Ключевые риски: (1) галлюцинации/ошибочные рекомендации, (2) утечки персональных данных (PII) и проблемы хранения, (3) безопасность: prompt injection и небезопасные действия через инструменты, (4) ошибки политики/права/комплаенса, (5) репутационные и UX-риски. Снижение: ответы с опорой на базу знаний/поиск (RAG) и ссылки, правила неопределённости/отказа, мониторинг и выборочный контроль качества, редактирование/маскирование PII и минимизация данных, не передавать секреты в промпты, доступ к инструментам по принципу наименьших привилегий (allowlist действий) + эскалация на оператора для чувствительных кейсов, аудит-логи и процедуры реагирования на инциденты.",
  "ai_context": "Задайте 2–3 сократических уточнения по: (1) галлюцинациям и способам измерения/сдерживания, (2) приватности/PII и хранению данных, (3) эскалации на человека и границам безопасных действий. Оценивайте практичность: политики, мониторинг и измеримые контроли."
}
